id_jogador,nome,apelido,nacionalidade_diferente,caracteristica_geral,esta_vivo,altura_categoria,pe_preferencial,ano_nascimento,imagem
329,Fabinho,Fabinho,0,"Volante de passadas longas e desarmes precisos do Liverpool, o reserva imediato de luxo para a cabeça de área.",1,Alto,Destro,1993,
330,Bruno Guimarães,Bruno Guimarães,0,"Meio-campista moderno de passes verticais e muita dinâmica, um dos grandes nomes da nova geração no futebol inglês.",1,Médio,Destro,1997,
331,Lucas Paquetá,Paquetá,0,"Meio-campista de muita criatividade e dancinhas nas comemorações, unia a armação com o recuo para ajudar Casemiro.",1,Médio,Canhoto,1997,
332,Everton Ribeiro,Éverton Ribeiro,0,"Meia de uma genialidade clássica e giros curtos fantásticos, maestro lendário do Flamengo que viajou como opção de cadência.",1,Baixo,Destro,1989,
333,Vinicius Junior,Vini Jr.,0,"O 'Malvadeza', ponta-esquerda campeão europeu pelo Real Madrid que usou seus dribles imparáveis e velocidade para fazer uma grande Copa.",1,Médio,Destro,2000,vinicius-jr.jpg
334,Rodrygo,Rodrygo,0,"O 'Raio', jovem atacante de inteligência espacial e técnica absurda que atuava em qualquer posição do ataque.",1,Baixo,Destro,2001,
335,Antony,Antony,0,"Ponta de dribles plásticos e giros característicos de futsal, o famoso 'spin', opção de drible na ponta direita.",1,Médio,Canhoto,2000,
336,Raphinha,Raphinha,0,"Ponta-direita de muita intensidade na pressão defensiva e arrancadas velozes pela ala, titular de confiança de Tite.",1,Médio,Canhoto,1996,raphinha.jpg
337,Gabriel Martinelli,Martinelli,0,"Ponta de velocidade explosiva e dedicação intensa do Arsenal, infernal atacando em direção ao gol na fase de grupos.",1,Médio,Destro,2001,
338,Richarlison,Richarlison,0,"O 'Pombo', camisa 9 do Catar que marcou o gol mais bonito de toda a Copa do Mundo em um voleio plástico espetacular contra a Sérvia.",1,Alto,Destro,1997,
339,Pedro,Pedro,0,"Centroavante clássico de área, o legítimo 'camisa 9' de pivôs geniais e finalizações letais de primeira do Flamengo.",1,Alto,Destro,1997,
